{
  "implementation": "statifier-ts",
  "corpus_hash": "sha256:324ad1bc630382dc168111c3a56ae37689ba96c85b20af288cdf22f28ad668a4",
  "claims": ["scion","statifier","w3c-mandatory","w3c-optional"],
  "entries": [
    {"case_id":"scion/actionSend/send1","suite":"scion"},
    {"case_id":"scion/actionSend/send2","suite":"scion"},
    {"case_id":"scion/actionSend/send3","suite":"scion"},
    {"case_id":"scion/actionSend/send4","suite":"scion"},
    {"case_id":"scion/actionSend/send4b","suite":"scion"},
    {"case_id":"scion/actionSend/send7","suite":"scion"},
    {"case_id":"scion/actionSend/send7b","suite":"scion"},
    {"case_id":"scion/actionSend/send8","suite":"scion"},
    {"case_id":"scion/actionSend/send8b","suite":"scion"},
    {"case_id":"scion/actionSend/send9","suite":"scion"},
    {"case_id":"scion/assign-current-small-step/test1","suite":"scion"},
    {"case_id":"scion/assign-current-small-step/test2","suite":"scion"},
    {"case_id":"scion/assign-current-small-step/test3","suite":"scion"},
    {"case_id":"scion/assign-current-small-step/test4","suite":"scion"},
    {"case_id":"scion/assign/assign_invalid","suite":"scion"},
    {"case_id":"scion/assign/assign_obj_literal","suite":"scion"},
    {"case_id":"scion/atom3-basic-tests/m0","suite":"scion"},
    {"case_id":"scion/atom3-basic-tests/m1","suite":"scion"},
    {"case_id":"scion/atom3-basic-tests/m2","suite":"scion"},
    {"case_id":"scion/atom3-basic-tests/m3","suite":"scion"},
    {"case_id":"scion/basic/basic0","suite":"scion"},
    {"case_id":"scion/basic/basic1","suite":"scion"},
    {"case_id":"scion/basic/basic2","suite":"scion"},
    {"case_id":"scion/cond-js/TestConditionalTransition","suite":"scion"},
    {"case_id":"scion/cond-js/test0","suite":"scion"},
    {"case_id":"scion/cond-js/test1","suite":"scion"},
    {"case_id":"scion/cond-js/test2","suite":"scion"},
    {"case_id":"scion/data/data_invalid","suite":"scion"},
    {"case_id":"scion/data/data_obj_literal","suite":"scion"},
    {"case_id":"scion/default-initial-state/initial1","suite":"scion"},
    {"case_id":"scion/default-initial-state/initial2","suite":"scion"},
    {"case_id":"scion/delayedSend/send1","suite":"scion"},
    {"case_id":"scion/delayedSend/send2","suite":"scion"},
    {"case_id":"scion/delayedSend/send3","suite":"scion"},
    {"case_id":"scion/documentOrder/documentOrder0","suite":"scion"},
    {"case_id":"scion/foreach/test1","suite":"scion"},
    {"case_id":"scion/hierarchy+documentOrder/test0","suite":"scion"},
    {"case_id":"scion/hierarchy+documentOrder/test1","suite":"scion"},
    {"case_id":"scion/hierarchy/hier0","suite":"scion"},
    {"case_id":"scion/hierarchy/hier1","suite":"scion"},
    {"case_id":"scion/hierarchy/hier2","suite":"scion"},
    {"case_id":"scion/history/history0","suite":"scion"},
    {"case_id":"scion/history/history1","suite":"scion"},
    {"case_id":"scion/history/history2","suite":"scion"},
    {"case_id":"scion/history/history3","suite":"scion"},
    {"case_id":"scion/history/history4","suite":"scion"},
    {"case_id":"scion/history/history4b","suite":"scion"},
    {"case_id":"scion/history/history5","suite":"scion"},
    {"case_id":"scion/history/history6","suite":"scion"},
    {"case_id":"scion/if-else/test0","suite":"scion"},
    {"case_id":"scion/in/TestInPredicate","suite":"scion"},
    {"case_id":"scion/internal-transitions/test0","suite":"scion"},
    {"case_id":"scion/internal-transitions/test1","suite":"scion"},
    {"case_id":"scion/misc/deep-initial","suite":"scion"},
    {"case_id":"scion/more-parallel/test0","suite":"scion"},
    {"case_id":"scion/more-parallel/test1","suite":"scion"},
    {"case_id":"scion/more-parallel/test2","suite":"scion"},
    {"case_id":"scion/more-parallel/test2b","suite":"scion"},
    {"case_id":"scion/more-parallel/test3","suite":"scion"},
    {"case_id":"scion/more-parallel/test3b","suite":"scion"},
    {"case_id":"scion/more-parallel/test4","suite":"scion"},
    {"case_id":"scion/more-parallel/test5","suite":"scion"},
    {"case_id":"scion/more-parallel/test6","suite":"scion"},
    {"case_id":"scion/more-parallel/test6b","suite":"scion"},
    {"case_id":"scion/more-parallel/test7","suite":"scion"},
    {"case_id":"scion/more-parallel/test8","suite":"scion"},
    {"case_id":"scion/more-parallel/test9","suite":"scion"},
    {"case_id":"scion/multiple-events-per-transition/test1","suite":"scion"},
    {"case_id":"scion/parallel+interrupt/test0","suite":"scion"},
    {"case_id":"scion/parallel+interrupt/test1","suite":"scion"},
    {"case_id":"scion/parallel+interrupt/test10","suite":"scion"},
    {"case_id":"scion/parallel+interrupt/test11","suite":"scion"},
    {"case_id":"scion/parallel+interrupt/test12","suite":"scion"},
    {"case_id":"scion/parallel+interrupt/test13","suite":"scion"},
    {"case_id":"scion/parallel+interrupt/test14","suite":"scion"},
    {"case_id":"scion/parallel+interrupt/test15","suite":"scion"},
    {"case_id":"scion/parallel+interrupt/test16","suite":"scion"},
    {"case_id":"scion/parallel+interrupt/test17","suite":"scion"},
    {"case_id":"scion/parallel+interrupt/test18","suite":"scion"},
    {"case_id":"scion/parallel+interrupt/test19","suite":"scion"},
    {"case_id":"scion/parallel+interrupt/test2","suite":"scion"},
    {"case_id":"scion/parallel+interrupt/test20","suite":"scion"},
    {"case_id":"scion/parallel+interrupt/test21","suite":"scion"},
    {"case_id":"scion/parallel+interrupt/test21b","suite":"scion"},
    {"case_id":"scion/parallel+interrupt/test21c","suite":"scion"},
    {"case_id":"scion/parallel+interrupt/test22","suite":"scion"},
    {"case_id":"scion/parallel+interrupt/test23","suite":"scion"},
    {"case_id":"scion/parallel+interrupt/test24","suite":"scion"},
    {"case_id":"scion/parallel+interrupt/test25","suite":"scion"},
    {"case_id":"scion/parallel+interrupt/test27","suite":"scion"},
    {"case_id":"scion/parallel+interrupt/test28","suite":"scion"},
    {"case_id":"scion/parallel+interrupt/test29","suite":"scion"},
    {"case_id":"scion/parallel+interrupt/test3","suite":"scion"},
    {"case_id":"scion/parallel+interrupt/test30","suite":"scion"},
    {"case_id":"scion/parallel+interrupt/test31","suite":"scion"},
    {"case_id":"scion/parallel+interrupt/test4","suite":"scion"},
    {"case_id":"scion/parallel+interrupt/test5","suite":"scion"},
    {"case_id":"scion/parallel+interrupt/test6","suite":"scion"},
    {"case_id":"scion/parallel+interrupt/test7","suite":"scion"},
    {"case_id":"scion/parallel+interrupt/test7b","suite":"scion"},
    {"case_id":"scion/parallel+interrupt/test8","suite":"scion"},
    {"case_id":"scion/parallel+interrupt/test9","suite":"scion"},
    {"case_id":"scion/parallel/test0","suite":"scion"},
    {"case_id":"scion/parallel/test1","suite":"scion"},
    {"case_id":"scion/parallel/test2","suite":"scion"},
    {"case_id":"scion/parallel/test3","suite":"scion"},
    {"case_id":"scion/script/test0","suite":"scion"},
    {"case_id":"scion/script/test1","suite":"scion"},
    {"case_id":"scion/script/test2","suite":"scion"},
    {"case_id":"scion/scxml-prefix-event-name-matching/star0","suite":"scion"},
    {"case_id":"scion/scxml-prefix-event-name-matching/test0","suite":"scion"},
    {"case_id":"scion/scxml-prefix-event-name-matching/test1","suite":"scion"},
    {"case_id":"scion/send-data/send1","suite":"scion"},
    {"case_id":"scion/send-idlocation/test0","suite":"scion"},
    {"case_id":"scion/send-internal/test0","suite":"scion"},
    {"case_id":"scion/targetless-transition/test0","suite":"scion"},
    {"case_id":"scion/targetless-transition/test1","suite":"scion"},
    {"case_id":"scion/targetless-transition/test2","suite":"scion"},
    {"case_id":"scion/targetless-transition/test3","suite":"scion"},
    {"case_id":"statifier/accepts/loan_declares_an_unreachable_event","suite":"statifier"},
    {"case_id":"statifier/diff/hold_queue_data_added","suite":"statifier"},
    {"case_id":"statifier/diff/hold_queue_identical","suite":"statifier"},
    {"case_id":"statifier/diff/hold_queue_renamed_with_mapping","suite":"statifier"},
    {"case_id":"statifier/diff/hold_queue_renamed_without_mapping","suite":"statifier"},
    {"case_id":"statifier/diff/hold_waiting_at_an_edited_state","suite":"statifier"},
    {"case_id":"statifier/diff/hold_waiting_through_an_idle_edit","suite":"statifier"},
    {"case_id":"statifier/diff/hold_waiting_under_an_edited_ancestor","suite":"statifier"},
    {"case_id":"statifier/diff/loan_waiting_across_a_damaged_arm","suite":"statifier"},
    {"case_id":"statifier/diff/loan_waiting_across_a_mapped_rename","suite":"statifier"},
    {"case_id":"statifier/diff/loan_waiting_across_a_regrouping","suite":"statifier"},
    {"case_id":"statifier/library/hold_queue_available_with_no_holds","suite":"statifier"},
    {"case_id":"statifier/library/hold_queue_collected_cancels_timer","suite":"statifier"},
    {"case_id":"statifier/library/hold_queue_expiry_moves_to_next","suite":"statifier"},
    {"case_id":"statifier/library/hold_queue_head_gets_pickup_timer","suite":"statifier"},
    {"case_id":"statifier/library/loan_dispute_returns_to_history","suite":"statifier"},
    {"case_id":"statifier/library/loan_due_soon_then_overdue","suite":"statifier"},
    {"case_id":"statifier/library/loan_lost_after_timer","suite":"statifier"},
    {"case_id":"statifier/library/loan_position_counts_renewals","suite":"statifier"},
    {"case_id":"statifier/library/loan_position_records_history","suite":"statifier"},
    {"case_id":"statifier/library/loan_renew_refused_at_max","suite":"statifier"},
    {"case_id":"statifier/library/loan_renew_refused_by_hold","suite":"statifier"},
    {"case_id":"statifier/library/loan_renew_within_limit","suite":"statifier"},
    {"case_id":"statifier/library/loan_returned_sends_copy_available","suite":"statifier"},
    {"case_id":"statifier/library/patron_checkout_allowed","suite":"statifier"},